
================================================================================
XOR Test Suite for Network_2L (TwoStageIsingNetwork)
================================================================================
Device: cuda
Batch size: 16
Epochs: 200
Model size: -1
Learning rates: gamma=0.001, lambda=0.001, offset=0.001, classical=0.001
Annealing: beta=[1, 10], reads=1, sweeps=1000
Generating 1D XOR data...
Total samples: 400, Features: 1
Class distribution: [200 200]
Train set: 320 samples - Class distribution: [160 160] ([50. 50.]%)
Test set: 80 samples - Class distribution: [40 40] ([50. 50.]%)

============================================================
Training Network_2L on 1D XOR
============================================================
Model size: 20
Model created with 4056 parameters

Starting training...
Epoch 10/200 | Loss: 0.2397 | Val Acc: 1.0000
Epoch 20/200 | Loss: 0.1258 | Val Acc: 0.9750
Epoch 30/200 | Loss: 0.0953 | Val Acc: 0.9875
Epoch 40/200 | Loss: 0.0761 | Val Acc: 0.9625
Epoch 50/200 | Loss: 0.0670 | Val Acc: 0.9500
Epoch 60/200 | Loss: 0.0707 | Val Acc: 0.9625
Epoch 70/200 | Loss: 0.0539 | Val Acc: 0.9625
Epoch 80/200 | Loss: 0.0527 | Val Acc: 1.0000
Epoch 90/200 | Loss: 0.0440 | Val Acc: 0.9875
Epoch 100/200 | Loss: 0.0561 | Val Acc: 0.9875
Epoch 110/200 | Loss: 0.0575 | Val Acc: 0.9875
Epoch 120/200 | Loss: 0.0361 | Val Acc: 0.9875
Epoch 130/200 | Loss: 0.0389 | Val Acc: 0.9875
Epoch 140/200 | Loss: 0.0377 | Val Acc: 1.0000
Epoch 150/200 | Loss: 0.0435 | Val Acc: 1.0000
Epoch 160/200 | Loss: 0.0329 | Val Acc: 1.0000
Epoch 170/200 | Loss: 0.0523 | Val Acc: 1.0000
Epoch 180/200 | Loss: 0.0297 | Val Acc: 1.0000
Epoch 190/200 | Loss: 0.0424 | Val Acc: 1.0000
Epoch 200/200 | Loss: 0.0428 | Val Acc: 1.0000

============================================================
Final Evaluation
============================================================
Final Test Accuracy: 0.9875

Classification Report:
              precision    recall  f1-score   support

     Class 0       0.98      1.00      0.99        40
     Class 1       1.00      0.97      0.99        40

    accuracy                           0.99        80
   macro avg       0.99      0.99      0.99        80
weighted avg       0.99      0.99      0.99        80


Confusion Matrix:
[[40  0]
 [ 1 39]]

1D XOR completed with accuracy: 0.9875 | Execution time: 3239.96s

Generating 2D XOR data...
Total samples: 800, Features: 2
Class distribution: [400 400]
Train set: 640 samples - Class distribution: [320 320] ([50. 50.]%)
Test set: 160 samples - Class distribution: [80 80] ([50. 50.]%)

============================================================
Training Network_2L on 2D XOR
============================================================
Model size: 20
Model created with 4056 parameters

Starting training...
Epoch 10/200 | Loss: 0.6256 | Val Acc: 0.9125
Epoch 20/200 | Loss: 0.5483 | Val Acc: 0.8438
Epoch 30/200 | Loss: 0.4722 | Val Acc: 0.9625
Epoch 40/200 | Loss: 0.3999 | Val Acc: 0.9625
Epoch 50/200 | Loss: 0.3382 | Val Acc: 0.9375
Epoch 60/200 | Loss: 0.3057 | Val Acc: 0.9313
Epoch 70/200 | Loss: 0.2805 | Val Acc: 0.9125
Epoch 80/200 | Loss: 0.2562 | Val Acc: 0.9437
Epoch 90/200 | Loss: 0.2361 | Val Acc: 0.9375
Epoch 100/200 | Loss: 0.2290 | Val Acc: 0.9437
Epoch 110/200 | Loss: 0.2153 | Val Acc: 0.9187
Epoch 120/200 | Loss: 0.2053 | Val Acc: 0.9437
Epoch 130/200 | Loss: 0.1985 | Val Acc: 0.8875
Epoch 140/200 | Loss: 0.1982 | Val Acc: 0.9313
Epoch 150/200 | Loss: 0.1844 | Val Acc: 0.9375
Epoch 160/200 | Loss: 0.1726 | Val Acc: 0.9688
Epoch 170/200 | Loss: 0.1652 | Val Acc: 0.9750
Epoch 180/200 | Loss: 0.1656 | Val Acc: 0.9688
Epoch 190/200 | Loss: 0.1534 | Val Acc: 0.9750
Epoch 200/200 | Loss: 0.1527 | Val Acc: 0.9750

============================================================
Final Evaluation
============================================================
Final Test Accuracy: 0.9750

Classification Report:
              precision    recall  f1-score   support

     Class 0       0.97      0.97      0.97        80
     Class 1       0.97      0.97      0.97        80

    accuracy                           0.97       160
   macro avg       0.97      0.97      0.97       160
weighted avg       0.97      0.97      0.97       160


Confusion Matrix:
[[78  2]
 [ 2 78]]

2D XOR completed with accuracy: 0.9750 | Execution time: 22944.25s

Generating 3D XOR data...
Total samples: 1600, Features: 3
Class distribution: [800 800]
Train set: 1280 samples - Class distribution: [640 640] ([50. 50.]%)
Test set: 320 samples - Class distribution: [160 160] ([50. 50.]%)

============================================================
Training Network_2L on 3D XOR
============================================================
Model size: 20
Model created with 4056 parameters

Starting training...
Epoch 10/200 | Loss: 0.6671 | Val Acc: 0.7250
Epoch 20/200 | Loss: 0.5839 | Val Acc: 0.6687
Epoch 30/200 | Loss: 0.4966 | Val Acc: 0.8156
Epoch 40/200 | Loss: 0.4348 | Val Acc: 0.8938
Epoch 50/200 | Loss: 0.3862 | Val Acc: 0.8375
Epoch 60/200 | Loss: 0.3508 | Val Acc: 0.8844
Epoch 70/200 | Loss: 0.3322 | Val Acc: 0.8969
Epoch 80/200 | Loss: 0.3127 | Val Acc: 0.8938
Epoch 90/200 | Loss: 0.2852 | Val Acc: 0.9062
Epoch 100/200 | Loss: 0.2764 | Val Acc: 0.8750
Epoch 110/200 | Loss: 0.2813 | Val Acc: 0.8906
Epoch 120/200 | Loss: 0.2595 | Val Acc: 0.8906
Epoch 130/200 | Loss: 0.2641 | Val Acc: 0.9062
Epoch 140/200 | Loss: 0.2483 | Val Acc: 0.8906
Epoch 150/200 | Loss: 0.2455 | Val Acc: 0.9031
Epoch 160/200 | Loss: 0.2357 | Val Acc: 0.8875
Epoch 170/200 | Loss: 0.2317 | Val Acc: 0.8906
Epoch 180/200 | Loss: 0.2307 | Val Acc: 0.9000
Epoch 190/200 | Loss: 0.2207 | Val Acc: 0.8906
Epoch 200/200 | Loss: 0.2157 | Val Acc: 0.9031

============================================================
Final Evaluation
============================================================
Final Test Accuracy: 0.9000

Classification Report:
              precision    recall  f1-score   support

     Class 0       0.90      0.91      0.90       160
     Class 1       0.91      0.89      0.90       160

    accuracy                           0.90       320
   macro avg       0.90      0.90      0.90       320
weighted avg       0.90      0.90      0.90       320


Confusion Matrix:
[[145  15]
 [ 17 143]]

3D XOR completed with accuracy: 0.9000 | Execution time: 46796.79s

Generating 4D XOR data...
Total samples: 3200, Features: 4
Class distribution: [1600 1600]
Train set: 2560 samples - Class distribution: [1280 1280] ([50. 50.]%)
Test set: 640 samples - Class distribution: [320 320] ([50. 50.]%)

============================================================
Training Network_2L on 4D XOR
============================================================
Model size: 20
Model created with 4056 parameters

Starting training...
Epoch 10/200 | Loss: 0.6619 | Val Acc: 0.6297
Epoch 20/200 | Loss: 0.5839 | Val Acc: 0.8547
Epoch 30/200 | Loss: 0.5035 | Val Acc: 0.9187
Epoch 40/200 | Loss: 0.4373 | Val Acc: 0.9000
Epoch 50/200 | Loss: 0.3852 | Val Acc: 0.8672
Epoch 60/200 | Loss: 0.3442 | Val Acc: 0.9422
Epoch 70/200 | Loss: 0.3153 | Val Acc: 0.9234
Epoch 80/200 | Loss: 0.2893 | Val Acc: 0.9141
Epoch 90/200 | Loss: 0.2716 | Val Acc: 0.9375
Epoch 100/200 | Loss: 0.2612 | Val Acc: 0.9187
Epoch 110/200 | Loss: 0.2477 | Val Acc: 0.9313
Epoch 120/200 | Loss: 0.2374 | Val Acc: 0.9297
Epoch 130/200 | Loss: 0.2220 | Val Acc: 0.9125
Epoch 140/200 | Loss: 0.2251 | Val Acc: 0.9203
Epoch 150/200 | Loss: 0.2097 | Val Acc: 0.9172
Epoch 160/200 | Loss: 0.2084 | Val Acc: 0.9453
Epoch 170/200 | Loss: 0.2047 | Val Acc: 0.9297
Epoch 180/200 | Loss: 0.2022 | Val Acc: 0.9344
Epoch 190/200 | Loss: 0.1963 | Val Acc: 0.9094
Epoch 200/200 | Loss: 0.1947 | Val Acc: 0.9328

============================================================
Final Evaluation
============================================================
Final Test Accuracy: 0.9406

Classification Report:
              precision    recall  f1-score   support

     Class 0       0.92      0.97      0.94       320
     Class 1       0.96      0.92      0.94       320

    accuracy                           0.94       640
   macro avg       0.94      0.94      0.94       640
weighted avg       0.94      0.94      0.94       640


Confusion Matrix:
[[309  11]
 [ 27 293]]

4D XOR completed with accuracy: 0.9406 | Execution time: 24884.69s

Generating 5D XOR data...
Total samples: 6400, Features: 5
Class distribution: [3200 3200]
Train set: 5120 samples - Class distribution: [2560 2560] ([50. 50.]%)
Test set: 1280 samples - Class distribution: [640 640] ([50. 50.]%)

============================================================
Training Network_2L on 5D XOR
============================================================
Model size: 20
Model created with 4056 parameters

Starting training...
Epoch 10/200 | Loss: 0.6893 | Val Acc: 0.5563
Epoch 20/200 | Loss: 0.6634 | Val Acc: 0.6789
Epoch 30/200 | Loss: 0.6034 | Val Acc: 0.7539
Epoch 40/200 | Loss: 0.5117 | Val Acc: 0.7602
Epoch 50/200 | Loss: 0.4449 | Val Acc: 0.7984
Epoch 60/200 | Loss: 0.3991 | Val Acc: 0.8414
Epoch 70/200 | Loss: 0.3679 | Val Acc: 0.8250
Epoch 80/200 | Loss: 0.3492 | Val Acc: 0.8516
Epoch 90/200 | Loss: 0.3378 | Val Acc: 0.8273
Epoch 100/200 | Loss: 0.3195 | Val Acc: 0.8297
Epoch 110/200 | Loss: 0.3163 | Val Acc: 0.8656
Epoch 120/200 | Loss: 0.3055 | Val Acc: 0.8719
Epoch 130/200 | Loss: 0.2979 | Val Acc: 0.8664
Epoch 140/200 | Loss: 0.2942 | Val Acc: 0.8641
Epoch 150/200 | Loss: 0.2900 | Val Acc: 0.8602
Epoch 160/200 | Loss: 0.2845 | Val Acc: 0.8562
Epoch 170/200 | Loss: 0.2758 | Val Acc: 0.8750
Epoch 180/200 | Loss: 0.2817 | Val Acc: 0.8680
Epoch 190/200 | Loss: 0.2709 | Val Acc: 0.8789
Epoch 200/200 | Loss: 0.2761 | Val Acc: 0.8695

============================================================
Final Evaluation
============================================================
Final Test Accuracy: 0.8789

Classification Report:
              precision    recall  f1-score   support

     Class 0       0.90      0.85      0.88       640
     Class 1       0.86      0.91      0.88       640

    accuracy                           0.88      1280
   macro avg       0.88      0.88      0.88      1280
weighted avg       0.88      0.88      0.88      1280


Confusion Matrix:
[[545  95]
 [ 60 580]]

5D XOR completed with accuracy: 0.8789 | Execution time: 28793.73s

Generating 6D XOR data...
Total samples: 12800, Features: 6
Class distribution: [6400 6400]
Train set: 10240 samples - Class distribution: [5120 5120] ([50. 50.]%)
Test set: 2560 samples - Class distribution: [1280 1280] ([50. 50.]%)

============================================================
Training Network_2L on 6D XOR
============================================================
Model size: 20
Model created with 4056 parameters

Starting training...
Epoch 10/200 | Loss: 0.6793 | Val Acc: 0.6219
Epoch 20/200 | Loss: 0.6083 | Val Acc: 0.7164
Epoch 30/200 | Loss: 0.4906 | Val Acc: 0.8457
Epoch 40/200 | Loss: 0.4125 | Val Acc: 0.8465
Epoch 50/200 | Loss: 0.3578 | Val Acc: 0.8449
Epoch 60/200 | Loss: 0.3252 | Val Acc: 0.8871
Epoch 70/200 | Loss: 0.3038 | Val Acc: 0.8867
Epoch 80/200 | Loss: 0.2822 | Val Acc: 0.8820
Epoch 90/200 | Loss: 0.2794 | Val Acc: 0.8934
Epoch 100/200 | Loss: 0.2738 | Val Acc: 0.8742
Epoch 110/200 | Loss: 0.2647 | Val Acc: 0.8852
Epoch 120/200 | Loss: 0.2739 | Val Acc: 0.8809
Epoch 130/200 | Loss: 0.2758 | Val Acc: 0.8797
Epoch 140/200 | Loss: 0.2748 | Val Acc: 0.8766
Epoch 150/200 | Loss: 0.2612 | Val Acc: 0.8805
Epoch 160/200 | Loss: 0.2643 | Val Acc: 0.8789
Epoch 170/200 | Loss: 0.2627 | Val Acc: 0.8891
Epoch 180/200 | Loss: 0.2609 | Val Acc: 0.8805
Epoch 190/200 | Loss: 0.2628 | Val Acc: 0.8918
Epoch 200/200 | Loss: 0.2647 | Val Acc: 0.8789

============================================================
Final Evaluation
============================================================
Final Test Accuracy: 0.8801

Classification Report:
              precision    recall  f1-score   support

     Class 0       0.87      0.89      0.88      1280
     Class 1       0.89      0.87      0.88      1280

    accuracy                           0.88      2560
   macro avg       0.88      0.88      0.88      2560
weighted avg       0.88      0.88      0.88      2560


Confusion Matrix:
[[1136  144]
 [ 163 1117]]

6D XOR completed with accuracy: 0.8801 | Execution time: 42321.01s


================================================================================
SUMMARY - XOR Performance Across Dimensions
================================================================================
1D XOR: 0.9875 | Execution time: 3239.96s
2D XOR: 0.9750 | Execution time: 22944.25s
3D XOR: 0.9000 | Execution time: 46796.79s
4D XOR: 0.9406 | Execution time: 24884.69s
5D XOR: 0.8789 | Execution time: 28793.73s
6D XOR: 0.8801 | Execution time: 42321.01s

Total execution time: 168980.43s (2816.34 minutes)

Plots saved to plots_xor_20260204_145903

XOR Test Suite Completed!
