
================================================================================
XOR Test Suite for Network_2L (TwoStageIsingNetwork)
================================================================================
Device: cuda
Batch size: 16
Epochs: 200
Model size: -1
Learning rates: gamma=0.001, lambda=0.001, offset=0.001, classical=0.001
Annealing: beta=[1, 10], reads=1, sweeps=1000
Generating 1D XOR data...
Total samples: 400, Features: 1
Class distribution: [200 200]
Train set: 320 samples - Class distribution: [160 160] ([50. 50.]%)
Test set: 80 samples - Class distribution: [40 40] ([50. 50.]%)

============================================================
Training Network_2L on 1D XOR
============================================================
Model size: 8
Model created with 696 parameters

Starting training...
Epoch 10/200 | Loss: 0.6324 | Val Acc: 0.7000
Epoch 20/200 | Loss: 0.5589 | Val Acc: 0.9500
Epoch 30/200 | Loss: 0.4419 | Val Acc: 0.9250
Epoch 40/200 | Loss: 0.3454 | Val Acc: 0.9250
Epoch 50/200 | Loss: 0.2796 | Val Acc: 0.9250
Epoch 60/200 | Loss: 0.2317 | Val Acc: 0.9500
Epoch 70/200 | Loss: 0.1955 | Val Acc: 0.9500
Epoch 80/200 | Loss: 0.1677 | Val Acc: 0.9500
Epoch 90/200 | Loss: 0.1446 | Val Acc: 0.9500
Epoch 100/200 | Loss: 0.1271 | Val Acc: 0.9625
Epoch 110/200 | Loss: 0.1088 | Val Acc: 0.9875
Epoch 120/200 | Loss: 0.0980 | Val Acc: 0.9875
Epoch 130/200 | Loss: 0.0893 | Val Acc: 1.0000
Epoch 140/200 | Loss: 0.0825 | Val Acc: 0.9875
Epoch 150/200 | Loss: 0.0768 | Val Acc: 1.0000
Epoch 160/200 | Loss: 0.0723 | Val Acc: 1.0000
Epoch 170/200 | Loss: 0.0662 | Val Acc: 1.0000
Epoch 180/200 | Loss: 0.0640 | Val Acc: 1.0000
Epoch 190/200 | Loss: 0.0621 | Val Acc: 1.0000
Epoch 200/200 | Loss: 0.0572 | Val Acc: 1.0000

============================================================
Final Evaluation
============================================================
Final Test Accuracy: 1.0000

Classification Report:
              precision    recall  f1-score   support

     Class 0       1.00      1.00      1.00        40
     Class 1       1.00      1.00      1.00        40

    accuracy                           1.00        80
   macro avg       1.00      1.00      1.00        80
weighted avg       1.00      1.00      1.00        80


Confusion Matrix:
[[40  0]
 [ 0 40]]

1D XOR completed with accuracy: 1.0000 | Execution time: 1390.72s

Generating 2D XOR data...
Total samples: 800, Features: 2
Class distribution: [400 400]
Train set: 640 samples - Class distribution: [320 320] ([50. 50.]%)
Test set: 160 samples - Class distribution: [80 80] ([50. 50.]%)

============================================================
Training Network_2L on 2D XOR
============================================================
Model size: 8
Model created with 696 parameters

Starting training...
Epoch 10/200 | Loss: 0.6499 | Val Acc: 0.9437
Epoch 20/200 | Loss: 0.5319 | Val Acc: 0.9437
Epoch 30/200 | Loss: 0.4146 | Val Acc: 0.9812
Epoch 40/200 | Loss: 0.3323 | Val Acc: 0.9812
Epoch 50/200 | Loss: 0.2848 | Val Acc: 0.9875
Epoch 60/200 | Loss: 0.2491 | Val Acc: 0.9437
Epoch 70/200 | Loss: 0.2245 | Val Acc: 0.9812
Epoch 80/200 | Loss: 0.2065 | Val Acc: 0.9875
Epoch 90/200 | Loss: 0.1872 | Val Acc: 0.9875
Epoch 100/200 | Loss: 0.1763 | Val Acc: 0.9688
Epoch 110/200 | Loss: 0.1649 | Val Acc: 0.9875
Epoch 120/200 | Loss: 0.1558 | Val Acc: 0.9812
Epoch 130/200 | Loss: 0.1562 | Val Acc: 0.9875
Epoch 140/200 | Loss: 0.1512 | Val Acc: 0.9750
Epoch 150/200 | Loss: 0.1400 | Val Acc: 0.9750
Epoch 160/200 | Loss: 0.1474 | Val Acc: 0.9875
Epoch 170/200 | Loss: 0.1320 | Val Acc: 0.9938
Epoch 180/200 | Loss: 0.1348 | Val Acc: 0.9875
Epoch 190/200 | Loss: 0.1299 | Val Acc: 0.9688
Epoch 200/200 | Loss: 0.1220 | Val Acc: 0.9750

============================================================
Final Evaluation
============================================================
Final Test Accuracy: 0.9750

Classification Report:
              precision    recall  f1-score   support

     Class 0       0.96      0.99      0.98        80
     Class 1       0.99      0.96      0.97        80

    accuracy                           0.97       160
   macro avg       0.98      0.98      0.97       160
weighted avg       0.98      0.97      0.97       160


Confusion Matrix:
[[79  1]
 [ 3 77]]

2D XOR completed with accuracy: 0.9750 | Execution time: 2801.69s

Generating 3D XOR data...
Total samples: 1600, Features: 3
Class distribution: [800 800]
Train set: 1280 samples - Class distribution: [640 640] ([50. 50.]%)
Test set: 320 samples - Class distribution: [160 160] ([50. 50.]%)

============================================================
Training Network_2L on 3D XOR
============================================================
Model size: 8
Model created with 696 parameters

Starting training...
Epoch 10/200 | Loss: 0.6893 | Val Acc: 0.5031
Epoch 20/200 | Loss: 0.6655 | Val Acc: 0.7344
Epoch 30/200 | Loss: 0.6055 | Val Acc: 0.7719
Epoch 40/200 | Loss: 0.5440 | Val Acc: 0.8031
Epoch 50/200 | Loss: 0.4955 | Val Acc: 0.8250
Epoch 60/200 | Loss: 0.4522 | Val Acc: 0.8375
Epoch 70/200 | Loss: 0.4194 | Val Acc: 0.8438
Epoch 80/200 | Loss: 0.3943 | Val Acc: 0.8469
Epoch 90/200 | Loss: 0.3666 | Val Acc: 0.8781
Epoch 100/200 | Loss: 0.3439 | Val Acc: 0.8906
Epoch 110/200 | Loss: 0.3327 | Val Acc: 0.9031
Epoch 120/200 | Loss: 0.3222 | Val Acc: 0.8969
Epoch 130/200 | Loss: 0.3115 | Val Acc: 0.9062
Epoch 140/200 | Loss: 0.3051 | Val Acc: 0.8906
Epoch 150/200 | Loss: 0.2942 | Val Acc: 0.8938
Epoch 160/200 | Loss: 0.2840 | Val Acc: 0.8906
Epoch 170/200 | Loss: 0.2728 | Val Acc: 0.8938
Epoch 180/200 | Loss: 0.2796 | Val Acc: 0.8969
Epoch 190/200 | Loss: 0.2774 | Val Acc: 0.8906
Epoch 200/200 | Loss: 0.2568 | Val Acc: 0.9031

============================================================
Final Evaluation
============================================================
Final Test Accuracy: 0.8969

Classification Report:
              precision    recall  f1-score   support

     Class 0       0.88      0.92      0.90       160
     Class 1       0.92      0.88      0.89       160

    accuracy                           0.90       320
   macro avg       0.90      0.90      0.90       320
weighted avg       0.90      0.90      0.90       320


Confusion Matrix:
[[147  13]
 [ 20 140]]

3D XOR completed with accuracy: 0.8969 | Execution time: 15559.67s

Generating 4D XOR data...
Total samples: 3200, Features: 4
Class distribution: [1600 1600]
Train set: 2560 samples - Class distribution: [1280 1280] ([50. 50.]%)
Test set: 640 samples - Class distribution: [320 320] ([50. 50.]%)

============================================================
Training Network_2L on 4D XOR
============================================================
Model size: 8
Model created with 696 parameters

Starting training...
Epoch 10/200 | Loss: 0.6944 | Val Acc: 0.4688
Epoch 20/200 | Loss: 0.6935 | Val Acc: 0.4672
Epoch 30/200 | Loss: 0.6931 | Val Acc: 0.4703
Epoch 40/200 | Loss: 0.6933 | Val Acc: 0.4844
Epoch 50/200 | Loss: 0.6929 | Val Acc: 0.4578
Epoch 60/200 | Loss: 0.6932 | Val Acc: 0.4828
Epoch 70/200 | Loss: 0.6926 | Val Acc: 0.4891
Epoch 80/200 | Loss: 0.6928 | Val Acc: 0.4969
Epoch 90/200 | Loss: 0.6925 | Val Acc: 0.5000
Epoch 100/200 | Loss: 0.6924 | Val Acc: 0.4922
Epoch 110/200 | Loss: 0.6923 | Val Acc: 0.4641
Epoch 120/200 | Loss: 0.6922 | Val Acc: 0.4953
Epoch 130/200 | Loss: 0.6924 | Val Acc: 0.5078
Epoch 140/200 | Loss: 0.6923 | Val Acc: 0.4891
Epoch 150/200 | Loss: 0.6922 | Val Acc: 0.4578
Epoch 160/200 | Loss: 0.6921 | Val Acc: 0.5078
Epoch 170/200 | Loss: 0.6926 | Val Acc: 0.4797
Epoch 180/200 | Loss: 0.6920 | Val Acc: 0.4922
Epoch 190/200 | Loss: 0.6919 | Val Acc: 0.4859
Epoch 200/200 | Loss: 0.6917 | Val Acc: 0.4766

============================================================
Final Evaluation
============================================================
Final Test Accuracy: 0.4797

Classification Report:
              precision    recall  f1-score   support

     Class 0       0.48      0.53      0.51       320
     Class 1       0.48      0.42      0.45       320

    accuracy                           0.48       640
   macro avg       0.48      0.48      0.48       640
weighted avg       0.48      0.48      0.48       640


Confusion Matrix:
[[171 149]
 [184 136]]

4D XOR completed with accuracy: 0.4797 | Execution time: 45517.56s

Generating 5D XOR data...
Total samples: 6400, Features: 5
Class distribution: [3200 3200]
Train set: 5120 samples - Class distribution: [2560 2560] ([50. 50.]%)
Test set: 1280 samples - Class distribution: [640 640] ([50. 50.]%)

============================================================
Training Network_2L on 5D XOR
============================================================
Model size: 8
Model created with 696 parameters

Starting training...
Epoch 10/200 | Loss: 0.6932 | Val Acc: 0.4930
Epoch 20/200 | Loss: 0.6932 | Val Acc: 0.4898
Epoch 30/200 | Loss: 0.6930 | Val Acc: 0.4820
Epoch 40/200 | Loss: 0.6930 | Val Acc: 0.4852
Epoch 50/200 | Loss: 0.6930 | Val Acc: 0.4836
Epoch 60/200 | Loss: 0.6929 | Val Acc: 0.4781
Epoch 70/200 | Loss: 0.6928 | Val Acc: 0.4891
Epoch 80/200 | Loss: 0.6926 | Val Acc: 0.4852
Epoch 90/200 | Loss: 0.6926 | Val Acc: 0.4875
Epoch 100/200 | Loss: 0.6931 | Val Acc: 0.4898
Epoch 110/200 | Loss: 0.6925 | Val Acc: 0.4898
Epoch 120/200 | Loss: 0.6926 | Val Acc: 0.4914
Epoch 130/200 | Loss: 0.6928 | Val Acc: 0.4938
Epoch 140/200 | Loss: 0.6919 | Val Acc: 0.4859
Epoch 150/200 | Loss: 0.6924 | Val Acc: 0.4820
Epoch 160/200 | Loss: 0.6925 | Val Acc: 0.4813
Epoch 170/200 | Loss: 0.6924 | Val Acc: 0.4914
Epoch 180/200 | Loss: 0.6926 | Val Acc: 0.4898
Epoch 190/200 | Loss: 0.6922 | Val Acc: 0.4961
Epoch 200/200 | Loss: 0.6923 | Val Acc: 0.4914

============================================================
Final Evaluation
============================================================
Final Test Accuracy: 0.4914

Classification Report:
              precision    recall  f1-score   support

     Class 0       0.49      0.80      0.61       640
     Class 1       0.48      0.19      0.27       640

    accuracy                           0.49      1280
   macro avg       0.49      0.49      0.44      1280
weighted avg       0.49      0.49      0.44      1280


Confusion Matrix:
[[509 131]
 [520 120]]

5D XOR completed with accuracy: 0.4914 | Execution time: 20896.49s

Generating 6D XOR data...
Total samples: 12800, Features: 6
Class distribution: [6400 6400]
Train set: 10240 samples - Class distribution: [5120 5120] ([50. 50.]%)
Test set: 2560 samples - Class distribution: [1280 1280] ([50. 50.]%)

============================================================
Training Network_2L on 6D XOR
============================================================
Model size: 8
Model created with 696 parameters

Starting training...
Epoch 10/200 | Loss: 0.6936 | Val Acc: 0.4992
Epoch 20/200 | Loss: 0.6936 | Val Acc: 0.4984
Epoch 30/200 | Loss: 0.6934 | Val Acc: 0.5090
Epoch 40/200 | Loss: 0.6934 | Val Acc: 0.5027
Epoch 50/200 | Loss: 0.6933 | Val Acc: 0.5031
Epoch 60/200 | Loss: 0.6933 | Val Acc: 0.5031
Epoch 70/200 | Loss: 0.6932 | Val Acc: 0.4980
Epoch 80/200 | Loss: 0.6932 | Val Acc: 0.5055
Epoch 90/200 | Loss: 0.6932 | Val Acc: 0.5000
Epoch 100/200 | Loss: 0.6933 | Val Acc: 0.5008
Epoch 110/200 | Loss: 0.6932 | Val Acc: 0.4973
Epoch 120/200 | Loss: 0.6933 | Val Acc: 0.4957
Epoch 130/200 | Loss: 0.6933 | Val Acc: 0.5098
Epoch 140/200 | Loss: 0.6932 | Val Acc: 0.4992
Epoch 150/200 | Loss: 0.6932 | Val Acc: 0.5004
Epoch 160/200 | Loss: 0.6932 | Val Acc: 0.5031
Epoch 170/200 | Loss: 0.6932 | Val Acc: 0.5008
Epoch 180/200 | Loss: 0.6932 | Val Acc: 0.5047
Epoch 190/200 | Loss: 0.6932 | Val Acc: 0.4992
Epoch 200/200 | Loss: 0.6932 | Val Acc: 0.4957

============================================================
Final Evaluation
============================================================
Final Test Accuracy: 0.5016

Classification Report:
              precision    recall  f1-score   support

     Class 0       0.50      0.42      0.46      1280
     Class 1       0.50      0.58      0.54      1280

    accuracy                           0.50      2560
   macro avg       0.50      0.50      0.50      2560
weighted avg       0.50      0.50      0.50      2560


Confusion Matrix:
[[544 736]
 [540 740]]

6D XOR completed with accuracy: 0.5016 | Execution time: 31155.67s


================================================================================
SUMMARY - XOR Performance Across Dimensions
================================================================================
1D XOR: 1.0000 | Execution time: 1390.72s
2D XOR: 0.9750 | Execution time: 2801.69s
3D XOR: 0.8969 | Execution time: 15559.67s
4D XOR: 0.4797 | Execution time: 45517.56s
5D XOR: 0.4914 | Execution time: 20896.49s
6D XOR: 0.5016 | Execution time: 31155.67s

Total execution time: 117321.79s (1955.36 minutes)

Plots saved to plots_xor_20260204_151632

XOR Test Suite Completed!
